[
  {
    "name": "id",
    "dbType": "increments",
    "htmlType": "",
    "validations": "",
    "searchable": false,
    "primary": true,
    "fillable": false,
    "inForm": false,
    "inIndex": false
  },
  {
    "name":"status",
    "dbType": "string,127",
    "htmlType": "text",
    "validations": "required"
  },
  {
    "name": "created_at",
    "dbType": "timestamp",
    "htmlType": "",
    "validations": "",
    "searchable": false,
    "fillable": false,
    "primary": false,
    "inForm": false,
    "inIndex": false
  },
  {
    "name": "updated_at",
    "dbType": "timestamp",
    "htmlType": "",
    "validations": "",
    "searchable": false,
    "fillable": false,
    "primary": false,
    "inForm": false,
    "inIndex": true
  }
]